{
  "schemaVersion": "1.0.0",
  "coverageGapId": "a22cb1f1-86fa-5122-af4f-15d40f67db84",
  "gapKey": "fl-madison-county-judicial",
  "jurisdictionName": "Madison County",
  "stateCode": "FL",
  "governmentLevel": "judicial",
  "officeFamily": "judicial",
  "expectedCountStatus": "expected_count_unknown",
  "expectedCount": null,
  "reason": "Judicial elected or retention seats counts for Madison County are not declared as expected seats. County commission district counts vary; municipal, school, judicial, and special-district inventories are not invented.",
  "coverageRegion": "remaining",
  "ledgerStatus": "coverage_gap"
}
