{
  "schemaVersion": "1.0.0",
  "coverageGapId": "7e10b6e3-9d48-585e-8c8f-be6c0a4febe0",
  "gapKey": "fl-orange-county-municipal",
  "jurisdictionName": "Orange County",
  "stateCode": "FL",
  "governmentLevel": "municipal",
  "officeFamily": "municipal",
  "expectedCountStatus": "expected_count_unknown",
  "expectedCount": null,
  "reason": "Municipal elected seats counts for Orange County are not declared as expected seats. County commission district counts vary; municipal, school, judicial, and special-district inventories are not invented.",
  "coverageRegion": "remaining",
  "ledgerStatus": "coverage_gap"
}
