{
  "schemaVersion": "1.0.0",
  "coverageGapId": "d7a7f203-7827-52f9-bf5a-7ccc94f084b5",
  "gapKey": "fl-alachua-county-judicial",
  "jurisdictionName": "Alachua County",
  "stateCode": "FL",
  "governmentLevel": "judicial",
  "officeFamily": "judicial",
  "expectedCountStatus": "expected_count_unknown",
  "expectedCount": null,
  "reason": "Judicial elected or retention seats counts for Alachua County are not declared as expected seats. County commission district counts vary; municipal, school, judicial, and special-district inventories are not invented.",
  "coverageRegion": "remaining",
  "ledgerStatus": "coverage_gap"
}
