{
  "schemaVersion": "1.0.0",
  "coverageGapId": "16f9b9e7-0853-5d94-ad01-f7853ac1da0c",
  "gapKey": "fl-desoto-county-county-commission",
  "jurisdictionName": "DeSoto County",
  "stateCode": "FL",
  "governmentLevel": "county",
  "officeFamily": "county_commission",
  "expectedCountStatus": "expected_count_unknown",
  "expectedCount": null,
  "reason": "County commission counts for DeSoto County are not declared as expected seats. County commission district counts vary; municipal, school, judicial, and special-district inventories are not invented.",
  "coverageRegion": "remaining",
  "ledgerStatus": "coverage_gap"
}
