{
  "schemaVersion": "1.0.0",
  "coverageGapId": "a8c6193e-30a8-5443-bfcd-3ed696740b51",
  "gapKey": "fl-gadsden-county-special-district",
  "jurisdictionName": "Gadsden County",
  "stateCode": "FL",
  "governmentLevel": "special_district",
  "officeFamily": "special_district",
  "expectedCountStatus": "expected_count_unknown",
  "expectedCount": null,
  "reason": "Special-district elected seats counts for Gadsden County are not declared as expected seats. County commission district counts vary; municipal, school, judicial, and special-district inventories are not invented.",
  "coverageRegion": "remaining",
  "ledgerStatus": "coverage_gap"
}
