{
  "schemaVersion": "1.0.0",
  "coverageGapId": "d415dca1-190a-55f4-8b4f-277961bd8298",
  "gapKey": "fl-indian-river-county-school-district",
  "jurisdictionName": "Indian River County",
  "stateCode": "FL",
  "governmentLevel": "school_district",
  "officeFamily": "school_district",
  "expectedCountStatus": "expected_count_unknown",
  "expectedCount": null,
  "reason": "School district elected seats counts for Indian River County are not declared as expected seats. County commission district counts vary; municipal, school, judicial, and special-district inventories are not invented.",
  "coverageRegion": "remaining",
  "ledgerStatus": "coverage_gap"
}
