{
  "schemaVersion": "1.0.0",
  "coverageGapId": "efcfb987-c7f0-5cc9-a1e7-f1c94015d2f8",
  "gapKey": "fl-franklin-county-school-district",
  "jurisdictionName": "Franklin County",
  "stateCode": "FL",
  "governmentLevel": "school_district",
  "officeFamily": "school_district",
  "expectedCountStatus": "expected_count_unknown",
  "expectedCount": null,
  "reason": "School district elected seats counts for Franklin County are not declared as expected seats. County commission district counts vary; municipal, school, judicial, and special-district inventories are not invented.",
  "coverageRegion": "remaining",
  "ledgerStatus": "coverage_gap"
}
