{
  "schemaVersion": "1.0.0",
  "coverageGapId": "1075f09a-7539-5832-a3a4-de7183be7471",
  "gapKey": "fl-hendry-county-municipal",
  "jurisdictionName": "Hendry County",
  "stateCode": "FL",
  "governmentLevel": "municipal",
  "officeFamily": "municipal",
  "expectedCountStatus": "expected_count_unknown",
  "expectedCount": null,
  "reason": "Municipal elected seats counts for Hendry County are not declared as expected seats. County commission district counts vary; municipal, school, judicial, and special-district inventories are not invented.",
  "coverageRegion": "remaining",
  "ledgerStatus": "coverage_gap"
}
