{
  "schemaVersion": "1.0.0",
  "coverageGapId": "2f817c31-b97b-5db1-930a-05500310b1e6",
  "gapKey": "fl-highlands-county-municipal",
  "jurisdictionName": "Highlands County",
  "stateCode": "FL",
  "governmentLevel": "municipal",
  "officeFamily": "municipal",
  "expectedCountStatus": "expected_count_unknown",
  "expectedCount": null,
  "reason": "Municipal elected seats counts for Highlands County are not declared as expected seats. County commission district counts vary; municipal, school, judicial, and special-district inventories are not invented.",
  "coverageRegion": "remaining",
  "ledgerStatus": "coverage_gap"
}
