{
  "schemaVersion": "1.0.0",
  "coverageGapId": "ea6274dc-0240-5292-9e84-ca766160f681",
  "gapKey": "fl-miami-dade-county-school-district",
  "jurisdictionName": "Miami-Dade County",
  "stateCode": "FL",
  "governmentLevel": "school_district",
  "officeFamily": "school_district",
  "expectedCountStatus": "expected_count_unknown",
  "expectedCount": null,
  "reason": "School district elected seats counts for Miami-Dade County are not declared as expected seats. County commission district counts vary; municipal, school, judicial, and special-district inventories are not invented.",
  "coverageRegion": "miami_dade",
  "ledgerStatus": "coverage_gap"
}
