{
  "schemaVersion": "1.0.0",
  "coverageGapId": "0c217fa7-87c1-55cd-bad3-6a47059791e8",
  "gapKey": "fl-leon-county-municipal",
  "jurisdictionName": "Leon County",
  "stateCode": "FL",
  "governmentLevel": "municipal",
  "officeFamily": "municipal",
  "expectedCountStatus": "expected_count_unknown",
  "expectedCount": null,
  "reason": "Municipal elected seats counts for Leon County are not declared as expected seats. County commission district counts vary; municipal, school, judicial, and special-district inventories are not invented.",
  "coverageRegion": "remaining",
  "ledgerStatus": "coverage_gap"
}
