{
  "schemaVersion": "1.0.0",
  "coverageGapId": "fa9a6829-e13c-5f6a-adb0-522467da65eb",
  "gapKey": "fl-wakulla-county-school-district",
  "jurisdictionName": "Wakulla County",
  "stateCode": "FL",
  "governmentLevel": "school_district",
  "officeFamily": "school_district",
  "expectedCountStatus": "expected_count_unknown",
  "expectedCount": null,
  "reason": "School district elected seats counts for Wakulla County are not declared as expected seats. County commission district counts vary; municipal, school, judicial, and special-district inventories are not invented.",
  "coverageRegion": "remaining",
  "ledgerStatus": "coverage_gap"
}
