{
  "schemaVersion": "1.0.0",
  "coverageGapId": "a9c27d85-bf86-572f-bd0c-0cf0cf1f53de",
  "gapKey": "fl-st-lucie-county-special-district",
  "jurisdictionName": "St. Lucie County",
  "stateCode": "FL",
  "governmentLevel": "special_district",
  "officeFamily": "special_district",
  "expectedCountStatus": "expected_count_unknown",
  "expectedCount": null,
  "reason": "Special-district elected seats counts for St. Lucie County are not declared as expected seats. County commission district counts vary; municipal, school, judicial, and special-district inventories are not invented.",
  "coverageRegion": "remaining",
  "ledgerStatus": "coverage_gap"
}
