{
  "schemaVersion": "1.0.0",
  "coverageGapId": "6fd303d6-48ee-5139-9b6d-32812e94d866",
  "gapKey": "fl-hendry-county-judicial",
  "jurisdictionName": "Hendry County",
  "stateCode": "FL",
  "governmentLevel": "judicial",
  "officeFamily": "judicial",
  "expectedCountStatus": "expected_count_unknown",
  "expectedCount": null,
  "reason": "Judicial elected or retention seats counts for Hendry County are not declared as expected seats. County commission district counts vary; municipal, school, judicial, and special-district inventories are not invented.",
  "coverageRegion": "remaining",
  "ledgerStatus": "coverage_gap"
}
