{
  "schemaVersion": "1.0.0",
  "coverageGapId": "e3662a46-69c6-585e-8af4-dfbafb6d7a38",
  "gapKey": "fl-citrus-county-judicial",
  "jurisdictionName": "Citrus County",
  "stateCode": "FL",
  "governmentLevel": "judicial",
  "officeFamily": "judicial",
  "expectedCountStatus": "expected_count_unknown",
  "expectedCount": null,
  "reason": "Judicial elected or retention seats counts for Citrus County are not declared as expected seats. County commission district counts vary; municipal, school, judicial, and special-district inventories are not invented.",
  "coverageRegion": "remaining",
  "ledgerStatus": "coverage_gap"
}
