{
  "schemaVersion": "1.0.0",
  "coverageGapId": "39fd0297-fb24-50cb-bade-ede2a6b37905",
  "gapKey": "fl-lake-county-county-commission",
  "jurisdictionName": "Lake County",
  "stateCode": "FL",
  "governmentLevel": "county",
  "officeFamily": "county_commission",
  "expectedCountStatus": "expected_count_unknown",
  "expectedCount": null,
  "reason": "County commission counts for Lake County are not declared as expected seats. County commission district counts vary; municipal, school, judicial, and special-district inventories are not invented.",
  "coverageRegion": "remaining",
  "ledgerStatus": "coverage_gap"
}
