{
  "schemaVersion": "1.0.0",
  "coverageGapId": "a37a4632-de01-5210-8dc3-80604590f60d",
  "gapKey": "fl-hamilton-county-special-district",
  "jurisdictionName": "Hamilton County",
  "stateCode": "FL",
  "governmentLevel": "special_district",
  "officeFamily": "special_district",
  "expectedCountStatus": "expected_count_unknown",
  "expectedCount": null,
  "reason": "Special-district elected seats counts for Hamilton County are not declared as expected seats. County commission district counts vary; municipal, school, judicial, and special-district inventories are not invented.",
  "coverageRegion": "remaining",
  "ledgerStatus": "coverage_gap"
}
