{
  "schemaVersion": "1.0.0",
  "coverageGapId": "e880b552-1a47-50c3-a2a4-3ce497937bbb",
  "gapKey": "fl-escambia-county-county-commission",
  "jurisdictionName": "Escambia County",
  "stateCode": "FL",
  "governmentLevel": "county",
  "officeFamily": "county_commission",
  "expectedCountStatus": "expected_count_unknown",
  "expectedCount": null,
  "reason": "County commission counts for Escambia County are not declared as expected seats. County commission district counts vary; municipal, school, judicial, and special-district inventories are not invented.",
  "coverageRegion": "remaining",
  "ledgerStatus": "coverage_gap"
}
