{
  "schemaVersion": "1.0.0",
  "coverageGapId": "269d8a08-83a4-53c7-b881-5735c144cdd6",
  "gapKey": "fl-gulf-county-municipal",
  "jurisdictionName": "Gulf County",
  "stateCode": "FL",
  "governmentLevel": "municipal",
  "officeFamily": "municipal",
  "expectedCountStatus": "expected_count_unknown",
  "expectedCount": null,
  "reason": "Municipal elected seats counts for Gulf County are not declared as expected seats. County commission district counts vary; municipal, school, judicial, and special-district inventories are not invented.",
  "coverageRegion": "remaining",
  "ledgerStatus": "coverage_gap"
}
