{
  "schemaVersion": "1.0.0",
  "coverageGapId": "8760f337-1aa7-534a-8420-36ed490396ad",
  "gapKey": "fl-polk-county-municipal",
  "jurisdictionName": "Polk County",
  "stateCode": "FL",
  "governmentLevel": "municipal",
  "officeFamily": "municipal",
  "expectedCountStatus": "expected_count_unknown",
  "expectedCount": null,
  "reason": "Municipal elected seats counts for Polk County are not declared as expected seats. County commission district counts vary; municipal, school, judicial, and special-district inventories are not invented.",
  "coverageRegion": "remaining",
  "ledgerStatus": "coverage_gap"
}
