{
  "schemaVersion": "1.0.0",
  "coverageGapId": "5938d904-08f5-520d-87b8-7491ca330c24",
  "gapKey": "fl-columbia-county-judicial",
  "jurisdictionName": "Columbia County",
  "stateCode": "FL",
  "governmentLevel": "judicial",
  "officeFamily": "judicial",
  "expectedCountStatus": "expected_count_unknown",
  "expectedCount": null,
  "reason": "Judicial elected or retention seats counts for Columbia County are not declared as expected seats. County commission district counts vary; municipal, school, judicial, and special-district inventories are not invented.",
  "coverageRegion": "remaining",
  "ledgerStatus": "coverage_gap"
}
